side|set|type|id|title|image|rarity|gempId|setId|gempid|imageUrl|row1color|row2color|row3color|row4color|row5color|row6color|counters|damage|destiny|lore|power|powercubes1|powercubes2|powerdots1|powerdots2|whoCanUseTheCard1|whoCanUseTheCard2|
light|enhancedmenaceofdarthmaul|character|P1|Qui-Gon Jinn, Jedi Protector|/enhancedmenaceofdarthmaul/light/quigonjinn.jpg|pm|4_P1|4|4_P1|https://res.starwarsccg.org/youngjedi/cards/enhancedmenaceofdarthmaul/light/quigonjinn.jpg|white|white|white|white|white|white|5|5|6|Adds power bonus when he is using Qui-Gon Jinn's Lightsaber.|6|||||||
light|enhancedmenaceofdarthmaul|character|P2|Mace Windu, Jedi Warrior|/enhancedmenaceofdarthmaul/light/macewindu.jpg|pm|4_P2|4|4_P2|https://res.starwarsccg.org/youngjedi/cards/enhancedmenaceofdarthmaul/light/macewindu.jpg|white|white|white|white|white|white|5|6|6|Adds power bonus when he is using Wisdom of the Council.|6|||||||
light|enhancedmenaceofdarthmaul|character|P3|Queen Amidala, Cunning Warrior|/enhancedmenaceofdarthmaul/light/queenamidala.jpg|pm|4_P3|4|4_P3|https://res.starwarsccg.org/youngjedi/cards/enhancedmenaceofdarthmaul/light/queenamidala.jpg|red|white|blue|white|green|white|2|3|6|Subtracts 2 from her DAMAGE when she is using Amidala's Blaster.|3|||||||
dark|enhancedmenaceofdarthmaul|character|P4|Darth Maul, Sith Assassin|/enhancedmenaceofdarthmaul/dark/darthmaul.jpg|pm|4_P4|4|4_P4|https://res.starwarsccg.org/youngjedi/cards/enhancedmenaceofdarthmaul/dark/darthmaul.jpg|white|white|white|white|white|white|5|5|6|Subtracts 2 from his DAMAGE when he is using Darth Maul's Lightsaber.|6|||||||
dark|enhancedmenaceofdarthmaul|character|P5|Sebulba, Champion Podracer Pilot|/enhancedmenaceofdarthmaul/dark/sebulba.jpg|pm|4_P5|4|4_P5|https://res.starwarsccg.org/youngjedi/cards/enhancedmenaceofdarthmaul/dark/sebulba.jpg|none|none|none|none|none|none|3|2|6|"""You have been well trained,my young apprentice.""-Darth Sidious"|4|||||||
dark|enhancedmenaceofdarthmaul|character|P6|Trade Federation Tank, Assault Leader|/enhancedmenaceofdarthmaul/dark/tradefederationtank.jpg|pm|4_P6|4|4_P6|https://res.starwarsccg.org/youngjedi/cards/enhancedmenaceofdarthmaul/dark/tradefederationtank.jpg|white|white|white|white|white|white|3|3|6|https://res.starwarsccg.org/youngjedi/cards/enhancedmenaceofdarthmaul/dark/tradefederationtank.jpg|4|||||||
